{
  "$schema": "contracts/schemas/processing-policy-trust-store.schema.json",
  "schema_id": "mdplace.processing-policy-trust-store/v1",
  "observer_id": "mdplace.package-validator/v1",
  "identity_assurance": "trusted_local_validator",
  "verification_method": "manifest_bound_receipt_readback",
  "scenarios": [
    {
      "scenario_id": "CPP-001",
      "vault_id": "vault:fixture-vault",
      "owner_principal_id": "person:vault-owner",
      "policy_bindings": [
        {
          "policy_id": "policy:core-processing",
          "policy_version": "1.0.0",
          "policy_sha256": "27a755ff5a6d91ce1f925c31cbc094bd25f70b54793dee4a9a4a56e8d3d07766",
          "lifecycle_state": "active"
        }
      ],
      "source_profile_bindings": [],
      "approval_receipt_sha256s": [
        "e7377f1ece5b8d711b3dac62fe4f93e0ff1940fc3001bf66c0e78401a4fe54f1"
      ],
      "redaction_receipt_sha256s": [
        "24a4845c2cbce985522d61b8b44bf42a0f5fa7b25c6a5e16320729d23b3c43a0",
        "4a1b52bf2f36e1bc834b20df223c921abb8ea01bb0d673bb08da5d4e6bfda807",
        "5d171a461e2853ec1dc122ca1fc761222ad41caf86ccbb4aead38dfbbc3af110"
      ],
      "attempt_receipt_sha256s": [
        "90ece6ead9d965f11729281f4caefbe5c615303c0fe4a2e8fd66ecdd28bf4cfe",
        "e95e17342f17d5487d70248b15ffdf754329a2c79ee3d4602f3c4d33c4d802fd"
      ]
    },
    {
      "scenario_id": "CPP-002",
      "vault_id": "vault:fixture-vault",
      "owner_principal_id": "person:vault-owner",
      "policy_bindings": [
        {
          "policy_id": "policy:core-processing",
          "policy_version": "1.0.0",
          "policy_sha256": "27a755ff5a6d91ce1f925c31cbc094bd25f70b54793dee4a9a4a56e8d3d07766",
          "lifecycle_state": "active"
        }
      ],
      "source_profile_bindings": [
        {
          "profile_id": "source-profile:web-clipper",
          "profile_version": "1.0.0",
          "profile_sha256": "e8653b33e417207545e8e87e0e53443506e0cace32270ca4df5f10dc0bdde549",
          "lifecycle_state": "active"
        }
      ],
      "approval_receipt_sha256s": [
        "6543c2e4f1400816b4fc0cbc538df661d97f0ee06bd18e2ab630683118425d10",
        "e7377f1ece5b8d711b3dac62fe4f93e0ff1940fc3001bf66c0e78401a4fe54f1"
      ],
      "redaction_receipt_sha256s": [
        "6cdf87df03076bcff386616d599593e665f1d7ec00da846445c4249bc6c0b653",
        "7f03797d7f2cd581c507f7acdae2001eb8fd6b60a3592bfc92b395849d05176d",
        "9855e215aeff595d1f349d42ebc2cd4ea2903dfd50cd1b604ec5684997cda868"
      ],
      "attempt_receipt_sha256s": [
        "561f307e4652f44e5d7da4b4b804c8110af2c720bb901d5e497e21c77e50d945",
        "f73d4aeeb3c3990e7fc34da53a740737373a725363242c177334e0f7fc9e8b03"
      ]
    },
    {
      "scenario_id": "CPP-003",
      "vault_id": "vault:fixture-vault",
      "owner_principal_id": "person:vault-owner",
      "policy_bindings": [
        {
          "policy_id": "policy:core-processing",
          "policy_version": "1.0.0",
          "policy_sha256": "bb738e1590e53c85f5f7f2a97c83b976818f318d398a94d0e538d86c5fa0bf46",
          "lifecycle_state": "active"
        }
      ],
      "source_profile_bindings": [],
      "approval_receipt_sha256s": [
        "b0491da51b17fd8bc40e90282e954b6672ed8462b95971c10f32eaf3fe827de0"
      ],
      "redaction_receipt_sha256s": [
        "2e152e2c36fd4280abb42b0428e7b54f755cf9451af5ff040f7fc10dcde59210",
        "94da5a447a8c3d5b5b37efd0ed99793476cdab22b7cb6293fbc1018ea714b8a8",
        "df21f0ddc8cede083b70031c4585bf998ee20620b592cf585463e78eb600e701"
      ],
      "attempt_receipt_sha256s": [
        "24f3e5c93b8db2ece184e6b185d463e65090ad33abdcf19430fb8130d5a8a9ea",
        "c4085283d3e137c8ff7679c5958b681af044f0db5c8087e88bcbbcad87a17328"
      ]
    },
    {
      "scenario_id": "CPP-004",
      "vault_id": "vault:fixture-vault",
      "owner_principal_id": "person:vault-owner",
      "policy_bindings": [
        {
          "policy_id": "policy:core-processing",
          "policy_version": "1.0.0",
          "policy_sha256": "27a755ff5a6d91ce1f925c31cbc094bd25f70b54793dee4a9a4a56e8d3d07766",
          "lifecycle_state": "active"
        },
        {
          "policy_id": "policy:core-processing",
          "policy_version": "1.0.1",
          "policy_sha256": "b1b6227eb6b0f5bbe580dcb93e77f5a780e98c745655f35661bf05d143ef029f",
          "lifecycle_state": "active"
        }
      ],
      "source_profile_bindings": [],
      "approval_receipt_sha256s": [
        "8df4d3c27437719186320bea471067ba3f9c661dff2848bb023eb671816fb7e3",
        "e7377f1ece5b8d711b3dac62fe4f93e0ff1940fc3001bf66c0e78401a4fe54f1"
      ],
      "redaction_receipt_sha256s": [],
      "attempt_receipt_sha256s": []
    },
    {
      "scenario_id": "CPP-005",
      "vault_id": "vault:fixture-vault",
      "owner_principal_id": "person:vault-owner",
      "policy_bindings": [
        {
          "policy_id": "policy:core-processing",
          "policy_version": "1.0.0",
          "policy_sha256": "27a755ff5a6d91ce1f925c31cbc094bd25f70b54793dee4a9a4a56e8d3d07766",
          "lifecycle_state": "active"
        },
        {
          "policy_id": "policy:core-processing",
          "policy_version": "1.0.1",
          "policy_sha256": "9f4de9ac0dde6f1c4eff53c35c91be47551f5463aa161a3dc1958d9b39624b18",
          "lifecycle_state": "active"
        }
      ],
      "source_profile_bindings": [],
      "approval_receipt_sha256s": [
        "126b879d81a7eea72b1756ab5f1ea8610d12d55ef418b24486b12f2f0732c35d",
        "e7377f1ece5b8d711b3dac62fe4f93e0ff1940fc3001bf66c0e78401a4fe54f1"
      ],
      "redaction_receipt_sha256s": [],
      "attempt_receipt_sha256s": []
    },
    {
      "scenario_id": "CPP-006",
      "vault_id": "vault:fixture-vault",
      "owner_principal_id": "person:vault-owner",
      "policy_bindings": [
        {
          "policy_id": "policy:core-processing",
          "policy_version": "1.0.0",
          "policy_sha256": "27a755ff5a6d91ce1f925c31cbc094bd25f70b54793dee4a9a4a56e8d3d07766",
          "lifecycle_state": "active"
        }
      ],
      "source_profile_bindings": [],
      "approval_receipt_sha256s": [
        "e7377f1ece5b8d711b3dac62fe4f93e0ff1940fc3001bf66c0e78401a4fe54f1"
      ],
      "redaction_receipt_sha256s": [
        "3615dae0e2eb7cb1e1c3add26339287de6cd90b95b82fd7dc445d66b2131d945",
        "7aec63c8eef59a4df152994f8bb6b78cd34e45a733f8f97056072956f2d71ce4",
        "c5ba40090275fbc9c8928b768f394f1f314e8d8ae2de30d4c6bba1d531fb1412"
      ],
      "attempt_receipt_sha256s": [
        "1c68541a7b0db461a4e14fff854e11a8386ea323a50b2030452d25e8a70efe21",
        "3a0fd8a95625160ff58b2498e577357cabba916b84ad667f7cf65ee79664e01e",
        "5c54230082fbd3fafd015971ea2aa776f3e290d5a5b907a9e0a3d1995f1cd45b"
      ]
    },
    {
      "scenario_id": "CPP-007",
      "vault_id": "vault:fixture-vault",
      "owner_principal_id": "person:vault-owner",
      "policy_bindings": [
        {
          "policy_id": "policy:core-processing",
          "policy_version": "1.0.0",
          "policy_sha256": "27a755ff5a6d91ce1f925c31cbc094bd25f70b54793dee4a9a4a56e8d3d07766",
          "lifecycle_state": "active"
        },
        {
          "policy_id": "policy:core-processing-child",
          "policy_version": "1.0.1",
          "policy_sha256": "8cad65de3d55756a9e9e023dd87d7b17f1a661515505e8d8b3862f1064caf79b",
          "lifecycle_state": "active"
        }
      ],
      "source_profile_bindings": [],
      "approval_receipt_sha256s": [
        "92d0a4b2a57980bb0c8e2df9537b0c3a85922590deb1606697ffdce2c180f22e",
        "e7377f1ece5b8d711b3dac62fe4f93e0ff1940fc3001bf66c0e78401a4fe54f1"
      ],
      "redaction_receipt_sha256s": [
        "21cddb146a646df2776f01576585108189b736acecf17baa3abbc257016307c0",
        "58838d4ec99a1309b2c32f44c922047b5a55c02208139149c9138f1eb5b2417a",
        "fdda703276f24126c4bfa9a2c25934c7fc13ec4e35a3d591040653cb3de5dad9"
      ],
      "attempt_receipt_sha256s": [
        "9ccf8ebc9af4a584afa8155fab15cfdfd49f417c03f7fdd214028af77dc44f61",
        "fdef46517e1e73e5f9affd7409703bbace7ec7a7be1419d5efb69c1736bdd78a"
      ]
    },
    {
      "scenario_id": "CPP-008",
      "vault_id": "vault:fixture-vault",
      "owner_principal_id": "person:vault-owner",
      "policy_bindings": [
        {
          "policy_id": "policy:core-processing",
          "policy_version": "1.0.0",
          "policy_sha256": "27a755ff5a6d91ce1f925c31cbc094bd25f70b54793dee4a9a4a56e8d3d07766",
          "lifecycle_state": "active"
        },
        {
          "policy_id": "policy:core-processing-child",
          "policy_version": "1.0.1",
          "policy_sha256": "7567e23cb5e5046fbc31ae185a370e014453d48120739c718029b5cb6662341a",
          "lifecycle_state": "active"
        }
      ],
      "source_profile_bindings": [],
      "approval_receipt_sha256s": [
        "a3cabe47b939c7f128f35b3c5c21f912d276fc201a9b0aedbdf2c9cd3b436d3b",
        "e7377f1ece5b8d711b3dac62fe4f93e0ff1940fc3001bf66c0e78401a4fe54f1"
      ],
      "redaction_receipt_sha256s": [
        "10fe64ef3cb7acd31842e23ecac83947549c2d7c3b8529555814d2978d8622ee",
        "deefd71569ad06d0ceaaa849f362f84214cbd7bd215c0f45f6e831584b8d8e8d",
        "f65ae9e23d35d29fe2c7d38333b74432f67f8b65955e8ab8dbe86049a2667b4a"
      ],
      "attempt_receipt_sha256s": [
        "1f054d37602855a5665eb50a64c0b1211d5f21db5953143d77e4c0dcaf5925f4",
        "8c043b37c4319fc5a980465e5357523accde6bb090fd28a994e2ca5e8942efd2",
        "cf87c9ce8fb38b384a206da3113c26e8ac89b132347d9882d0cc4f075943512a"
      ]
    },
    {
      "scenario_id": "CPP-009",
      "vault_id": "vault:fixture-vault",
      "owner_principal_id": "person:vault-owner",
      "policy_bindings": [
        {
          "policy_id": "policy:core-processing",
          "policy_version": "1.0.0",
          "policy_sha256": "27a755ff5a6d91ce1f925c31cbc094bd25f70b54793dee4a9a4a56e8d3d07766",
          "lifecycle_state": "active"
        }
      ],